{
  "schema_version": "1.1.0",
  "analysis_id": "sample-wwii-en",
  "generated_at": "2026-04-27T00:00:00Z",
  "language": "en",
  "model_mode": "research",
  "analysis_lens": "strategic",
  "subject": {
    "title": "Sample: World War II outcomes",
    "context": "1939–1947, international order",
    "question": "How did World War II outcomes reshape the global system?",
    "executive_thesis": "World War II ended the old European balance of power and opened a bipolar order led by the United States and the Soviet Union."
  },
  "interests": [
    {
      "name": "Prevent renewed German hegemony",
      "type": "strategic",
      "intensity": 5,
      "horizon": "long",
      "stakes": "existential",
      "confidence": "high",
      "rationale": "Two world wars made German containment a central Allied security interest.",
      "id": "I1"
    }
  ],
  "actors": [
    {
      "name": "United States",
      "category": "state",
      "financial": 5,
      "decision_access": 5,
      "disruption_capacity": 4,
      "media_influence": 4,
      "confidence": "high",
      "rationale": "Industrial, financial, and military capacity enabled postwar leadership.",
      "id": "A1"
    }
  ],
  "tools": [
    {
      "name": "New international institutions",
      "type": "diplomatic",
      "cost": 3,
      "risk": 2,
      "speed": 3,
      "reversibility": 2,
      "deniability": 1,
      "confidence": "high",
      "rationale": "The UN and Bretton Woods institutions provided coordination and legitimacy.",
      "id": "T1"
    }
  ],
  "narrative": [
    {
      "name": "Prevent another total war",
      "frame": "security",
      "coherence": 5,
      "media_alignment": 4,
      "public_acceptance": 5,
      "confidence": "high",
      "rationale": "The narrative was coherent after unprecedented losses.",
      "id": "N1"
    }
  ],
  "results": [
    {
      "name": "Rise of bipolarity",
      "type": "direct",
      "goal_achieved_pct": 70,
      "cost_benefit": 3,
      "power_balance_impact": "strengthened",
      "confidence": "high",
      "rationale": "Europe receded while Washington and Moscow rose.",
      "id": "R1"
    }
  ],
  "feedback": [
    {
      "description": "Mutual fear drove military alliances and arms competition.",
      "adapts": "tools",
      "speed": "fast",
      "confidence": "high",
      "rationale": "Security outcomes reshaped tools and alliances.",
      "id": "F1"
    }
  ],
  "contradictions": {
    "items": [
      {
        "rhetoric": "Liberating peoples and preventing tyranny",
        "contradiction_type": "rhetoric_vs_action",
        "affected_layers": [
          "narrative",
          "tools",
          "results"
        ],
        "actions": [
          "Division of spheres of influence in Europe",
          "Acceptance of dependent regimes inside the Soviet sphere"
        ],
        "interpretation": "Moral rhetoric operated alongside hard security calculations.",
        "severity": 4,
        "confidence": "high",
        "id": "C1"
      }
    ]
  },
  "scenarios": {
    "items": [
      {
        "name": "Consolidation of bipolar order",
        "probability": 70,
        "timeframe": "1947–1955",
        "drivers": [
          "Ideological polarization"
        ],
        "early_signals": [
          "Marshall Plan",
          "Truman Doctrine"
        ],
        "disproven_if": [
          "Successful pan-European security settlement"
        ],
        "rationale": "Early indicators supported institutional and military division.",
        "id": "S1"
      }
    ]
  },
  "evidence": {
    "items": [
      {
        "claim": "Europe lost centrality after the war.",
        "basis": "source_based",
        "source_note": "Inferred from post-1945 power distribution.",
        "confidence": "high",
        "id": "E1",
        "source_title": "Historical power distribution reference",
        "source_url": "",
        "source_date": "unknown",
        "source_type": "other",
        "evidence_strength": 3,
        "uncertainty": "Aggregated historical inference; source specificity should be improved in research use.",
        "counter_evidence": "Some European states retained substantial institutional and economic capacity after 1945."
      }
    ]
  },
  "assumptions": {
    "items": [
      {
        "assumption": "Great powers will prefer institutional stability over isolation.",
        "risk": "medium",
        "disproving_test": "Rapid U.S. withdrawal from Europe and collapse of Bretton Woods.",
        "implication_if_wrong": "The order becomes more fluid and less predictable.",
        "id": "AS1"
      }
    ]
  },
  "links": [
    {
      "from": "I1",
      "to": "A1",
      "relation": "motivates",
      "strength": 4
    },
    {
      "from": "A1",
      "to": "T1",
      "relation": "uses",
      "strength": 4
    },
    {
      "from": "T1",
      "to": "R1",
      "relation": "produces",
      "strength": 3
    }
  ],
  "quality_gate": {
    "publication_risk": "medium",
    "weakest_layer": "evidence",
    "next_improvement": "Replace generic historical notes with precise source citations."
  }
}
