{
  "schema_version": "1.1.0",
  "analysis_id": "sample-wwii-fr",
  "generated_at": "2026-04-27T00:00:00Z",
  "language": "fr",
  "model_mode": "research",
  "analysis_lens": "strategic",
  "subject": {
    "title": "Exemple : résultats de la Seconde Guerre mondiale",
    "context": "1939–1947, ordre international",
    "question": "Comment les résultats de la Seconde Guerre mondiale ont-ils remodelé l’ordre international ?",
    "executive_thesis": "La guerre a déplacé le centre de gravité du système international vers les États-Unis et l’Union soviétique, tout en créant une architecture institutionnelle destinée à empêcher une nouvelle guerre totale."
  },
  "interests": [
    {
      "name": "Empêcher le retour de l’hégémonie allemande",
      "type": "strategic",
      "intensity": 5,
      "horizon": "long",
      "stakes": "existential",
      "confidence": "high",
      "rationale": "Deux guerres mondiales ont transformé le contrôle de la puissance allemande en priorité de sécurité.",
      "id": "I1"
    }
  ],
  "actors": [
    {
      "name": "États-Unis",
      "category": "state",
      "financial": 5,
      "decision_access": 5,
      "disruption_capacity": 4,
      "media_influence": 4,
      "confidence": "high",
      "rationale": "Leur capacité industrielle, financière et militaire leur permettait d’organiser l’ordre d’après-guerre.",
      "id": "A1"
    }
  ],
  "tools": [
    {
      "name": "Institutions internationales",
      "type": "diplomatic",
      "cost": 3,
      "risk": 2,
      "speed": 3,
      "reversibility": 2,
      "deniability": 1,
      "confidence": "high",
      "rationale": "L’ONU et Bretton Woods ont fourni des instruments de coordination et de légitimité.",
      "id": "T1"
    }
  ],
  "narrative": [
    {
      "name": "Empêcher une nouvelle guerre totale",
      "frame": "security",
      "coherence": 5,
      "media_alignment": 4,
      "public_acceptance": 5,
      "confidence": "high",
      "rationale": "Le traumatisme humain et matériel rendait ce cadrage très puissant.",
      "id": "N1"
    }
  ],
  "results": [
    {
      "name": "Ordre bipolaire",
      "type": "direct",
      "goal_achieved_pct": 75,
      "cost_benefit": 3,
      "power_balance_impact": "strengthened",
      "confidence": "high",
      "rationale": "Le pouvoir s’est concentré autour de Washington et Moscou.",
      "id": "R1"
    }
  ],
  "feedback": [
    {
      "description": "La rivalité entre alliés a transformé la coopération militaire en compétition idéologique.",
      "adapts": "actors",
      "speed": "fast",
      "confidence": "high",
      "rationale": "Les intérêts de sécurité ont divergé dès la reconstruction.",
      "id": "F1"
    }
  ],
  "contradictions": {
    "items": [
      {
        "rhetoric": "La sécurité collective empêcherait une nouvelle guerre mondiale.",
        "contradiction_type": "result_vs_intention",
        "actions": [
          "Le Conseil de sécurité a donné un veto aux grandes puissances.",
          "La rivalité Est-Ouest a limité l’application collective."
        ],
        "affected_layers": [
          "narrative",
          "results",
          "feedback"
        ],
        "interpretation": "La sécurité collective dépendait d’une hiérarchie de puissances plutôt que d’une égalité souveraine complète.",
        "severity": 8,
        "confidence": "high",
        "id": "C1"
      }
    ]
  },
  "scenarios": {
    "items": [
      {
        "name": "Normalisation institutionnelle contenue",
        "probability": 45,
        "timeframe": "1947–1955",
        "drivers": [
          "Reconstruction européenne",
          "Dépendance à l’aide américaine",
          "Institutionnalisation multilatérale"
        ],
        "early_signals": [
          "Plans de reconstruction",
          "Nouvelles alliances",
          "Coordination économique"
        ],
        "disproven_if": [
          "Les grandes puissances acceptent une gouvernance réellement égalitaire."
        ],
        "rationale": "L’ordre devient stable mais hiérarchisé.",
        "id": "S1"
      }
    ]
  },
  "evidence": {
    "items": [
      {
        "claim": "Les États-Unis sortent de la guerre avec une puissance industrielle et financière exceptionnelle.",
        "basis": "source_based",
        "source_note": "Données historiques générales sur la production et le financement de guerre.",
        "confidence": "high",
        "id": "E1",
        "source_title": "Historical power distribution reference",
        "source_url": "",
        "source_date": "unknown",
        "source_type": "other",
        "evidence_strength": 3,
        "uncertainty": "Aggregated historical inference; source specificity should be improved in research use.",
        "counter_evidence": "Some European states retained substantial institutional and economic capacity after 1945."
      }
    ]
  },
  "assumptions": {
    "items": [
      {
        "assumption": "La stabilité d’après-guerre dépend de la capacité américaine à financer la reconstruction.",
        "risk": "medium",
        "disproving_test": "Montrer une reconstruction équivalente sans financement américain.",
        "implication_if_wrong": "Le poids causal des institutions américaines serait surestimé.",
        "id": "AS1"
      }
    ]
  },
  "links": [
    {
      "from": "I1",
      "to": "A1",
      "relation": "motivates",
      "strength": 4
    },
    {
      "from": "A1",
      "to": "T1",
      "relation": "uses",
      "strength": 4
    },
    {
      "from": "T1",
      "to": "R1",
      "relation": "produces",
      "strength": 3
    }
  ],
  "quality_gate": {
    "publication_risk": "medium",
    "weakest_layer": "evidence",
    "next_improvement": "Replace generic historical notes with precise source citations."
  }
}
